{"candidate_evaluations":[{"candidate_id":"minimal-settled-set","candidate_implementation_sha256":"7e450d1725ac0d5f0d43374fa4a8ab0c9c43fe578c651bd1652789b0cebfa775","evaluation_report_locator":"compatibility/minimal-settled-set/evaluation-report.json","evaluation_report_sha256":"af150c9ff1a9fff4681787ed06583608d2bd39a7932741189d931c17e5916bbe","execution_receipt_locator":"compatibility/minimal-settled-set/execution-receipt.json","execution_receipt_sha256":"dc2fbfc5d00a30616a1bb2c6faad5132ad1c0b4279c72333db4432f890d635a1"},{"candidate_id":"persisted-task-registry","candidate_implementation_sha256":"b3c44c7d90892dc65715690c44a14ebfa6220784459e8dedf481358edad1dd31","evaluation_report_locator":"compatibility/persisted-task-registry/evaluation-report.json","evaluation_report_sha256":"463413284a50dea4521d0cfca9166ef1f23278abc37b2bb6f9624a73b2c60296","execution_receipt_locator":"compatibility/persisted-task-registry/execution-receipt.json","execution_receipt_sha256":"a0872caca870c0a6298e4da9e5fa0644f99b93c7b1610a19b1e2678a45ebda97"}],"dimensions":[{"assessments":[{"candidate_id":"minimal-settled-set","evidence":"The candidate keeps terminal task IDs only in memory, identifies interruption or context-compaction memory loss as its main risk, and did not establish durable recovery after process loss or compaction.","rating":"weaker"},{"candidate_id":"persisted-task-registry","evidence":"The run performed atomic disk-backed generations, reloaded after interruption, verified the persisted dispatch and checkpoint, and retained the reconciled late report in the final registry.","rating":"preferred"}],"dimension":"compaction_recovery","preferred_candidate_id":"persisted-task-registry"},{"assessments":[{"candidate_id":"minimal-settled-set","evidence":"The run reconciled late report E4 before synthesis and included it in the final review state.","rating":"acceptable"},{"candidate_id":"persisted-task-registry","evidence":"The run reconciled E4 before E5 and synthesis; the registry includes E4 in the terminal receipt, report inventory, and canonical ledger.","rating":"acceptable"}],"dimension":"late_result_handling","preferred_candidate_id":null},{"assessments":[{"candidate_id":"minimal-settled-set","evidence":"The run records E1 as the sole dispatch and treats T-claim as terminal after E4, preventing redispatch on E5.","rating":"acceptable"},{"candidate_id":"persisted-task-registry","evidence":"The registry records dispatch_count 1 and an E5 do_not_dispatch decision because a valid terminal record exists.","rating":"acceptable"}],"dimension":"duplicate_dispatch","preferred_candidate_id":null},{"assessments":[{"candidate_id":"minimal-settled-set","evidence":"Final reconciliation retained E4 for synthesis, but the retained lifecycle state was in memory and no durable report or receipt recovery was demonstrated.","rating":"acceptable"},{"candidate_id":"persisted-task-registry","evidence":"The disk registry retains bounded input hashes, dispatch proof, terminal receipt, report hash, report inventory, coverage obligation, and E4 as a canonical synthesis input.","rating":"preferred"}],"dimension":"evidence_retention","preferred_candidate_id":"persisted-task-registry"},{"assessments":[{"candidate_id":"minimal-settled-set","evidence":"The contract minimizes orchestration state and repeated instructions by using a canonical task ID and an in-memory terminal set.","rating":"preferred"},{"candidate_id":"persisted-task-registry","evidence":"The contract requires atomic persistence, generations, synchronized writes, receipt and report-hash validation, reload logic, and a larger corruption surface.","rating":"weaker"}],"dimension":"complexity","preferred_candidate_id":"minimal-settled-set"},{"assessments":[{"candidate_id":"minimal-settled-set","evidence":"It correctly retained bounded claim C1 as supported by E1 and surfaced only overbroad unsupported claim C2.","rating":"acceptable"},{"candidate_id":"persisted-task-registry","evidence":"It made the same correct claim-evidence decisions; the evidence does not show better scientific review quality from persistence.","rating":"acceptable"}],"dimension":"review_quality","preferred_candidate_id":null}],"executor_ids":["executor-minimal-settled-set","executor-persisted-task-registry"],"fixture_manifest_locator":"evals/adapter-fixtures/manifest.json","fixture_manifest_sha256":"d61c2299f9390e7cc3d714e19c5ffae55828cbf493d5eefe0ce95f5d5f509fff","fixture_set":"forward-v1","independent_review_performed":true,"limitations":["The comparison is restricted to the two bounded fixtures and six declared dimensions; fixture oracles were not available to the semantic reviewer.","The persistence trace covers one interruption stream, not arbitrary crashes, registry corruption, concurrent writers, or production-scale operation.","Both quality traces cover only two claim-evidence decisions and do not establish broader scientific-review capability.","Requested model and effort were recorded, while host-effective runtime telemetry was not surfaced."],"rationale":"All five frozen input hashes were recomputed before review. Persisted-task-registry received strict preferences for compaction recovery and evidence retention, while minimal-settled-set received one for complexity; the resulting two-to-one strict-preference majority selects persisted-task-registry. Late-result handling, duplicate dispatch, and scientific review quality were genuine ties.","receipt_kind":"adapter_semantic_review","review_id":"SEM-2026-07-28-SOL-ULTRA-001","reviewed_at":"2026-07-28T10:05:10Z","reviewer":{"configuration_state":"requested_and_recorded","effective_telemetry":"not_surfaced","independent":true,"requested_mode":"ultra","requested_model":"gpt-5.6-sol","resolved_mode":null,"resolved_model":null,"reviewer_id":"independent-adapter-semantic-judge"},"schema_version":"1.0.0","selected_candidate_id":"persisted-task-registry","selection_rule":"strict_preference_majority","verdict":"selected"}
